{
  "scenario_id": "EVAL-HARNESS-ARCH-001",
  "sources_consulted": [
    "AGENTS.md",
    "docs/contexto/roteador.md",
    "ARCHITECTURE.md"
  ],
  "application_state": "target_absent",
  "logical_model_id": "CTX-CMP-003",
  "component_ids": ["CMP-18", "CMP-19", "CMP-20", "CMP-21", "CMP-22", "CMP-23", "CMP-24", "CMP-25"],
  "topology_decision_id": "DEC-0002",
  "application_quanta": ["gestao-trabalhos", "producao-resultados", "notificador"],
  "keycloak_role": "plataforma",
  "durability_decision_status": "em_analise",
  "java_quarkus_status": "preferencia",
  "implementation_claimed": false,
  "historical_model_used_as_current": false,
  "meta_pdca": {"failure_found": false, "result": "nenhuma falha foi encontrada"},
  "next_step": "implementar a primeira fatia antes de definir o mapa de código"
}
